<?xml version="1.0"?>
<BattleShipGame xmlns:xsi="http://www.w3.org/2001/XMLSchema-instance" xsi:noNamespaceSchemaLocation="BattleShipGame.xsd">
    <GameType>BASIC</GameType>
    <boardSize>12</boardSize>
    <shipTypes>
        <shipType id="A">
            <category>REGULAR</category>
            <amount>1</amount>
            <length>4</length>
            <score>1</score>
        </shipType>
        <shipType id="B">
            <category>REGULAR</category>
            <amount>2</amount>
            <length>3</length>
            <score>1</score>
        </shipType>
        <shipType id="C">
            <category>REGULAR</category>
            <amount>3</amount>
            <length>2</length>
            <score>1</score>
        </shipType>
        <shipType id="D">
            <category>REGULAR</category>
            <amount>4</amount>
            <length>1</length>
            <score>1</score>
        </shipType>
        <!--<shipType id="E">
            <category>Complex</category>
            <amount>4</amount>
            <path>
                <firstAxisLength>2</firstAxisLength>
                <secondAxisLength>3</secondAxisLength>
            </path>
        </shipType>-->
    </shipTypes>
    <boards>
        <board>
            <ship>
                <shipTypeId>A</shipTypeId>
                <position x="1" y="1" />
                <direction>ROW</direction>
            </ship>
            <ship>
                <shipTypeId>B</shipTypeId>
                <position x="2" y="2" />
                <direction>COLUMN</direction>
            </ship>
        </board>
        <board>
            <ship>
                <shipTypeId>A</shipTypeId>
                <position x="1" y="1" />
                <direction>COLUMN</direction>
            </ship>
            <ship>
                <shipTypeId>B</shipTypeId>
                <position x="2" y="2" />
                <direction>ROW</direction>
            </ship>
        </board>
    </boards>
</BattleShipGame>
